control_id,control_title,tier,nist_function,nist_ref,eu_article,bio2_ref,nis2_article,nora_ref,cra_ref,dsa_ref,ai_liability_ref,coverage,approved_by
NED-01,AI Impact Assessment,priority,MAP,"MAP-1.1: Identify and assess risks to individuals, groups, and society",Art. 9(2): Risk management system; Art. 27: Fundamental Rights Impact Assessment,A.5-6: Risicoanalyse en -behandeling,Art. 21: Risk management measures,Grondslag-toets: Beoordeling grondslag bij AI-toepassingen,Art. 10: Risk assessment for products with digital elements,N/A,Art. 3: Burden of proof in AI damage claims,full,DjimIT (self-reviewed)
NED-02,Bias & Fairness Testing,priority,MAP + MEASURE,MAP-2.3: Potential impacts to individuals; MEASURE-1.2: AI system trustworthiness,Art. 10: Data and data governance — bias monitoring in training data,N/A,N/A,Evenredigheid: AI-besluiten mogen niet discrimineren,N/A,Art. 27: Transparency of recommender system parameters,Art. 4(3): Non-compliance with instructions as contributory cause,partial,DjimIT (self-reviewed)
NED-03,Human Oversight,priority,GOVERN + MANAGE,GOVERN-1.4: Human oversight policies; MANAGE-2.1: Human intervention,Art. 14: Human oversight measures for high-risk AI systems,N/A,N/A,Proportionaliteit: Menselijke tussenkomst bij proportionele AI-inzet,N/A,N/A,Art. 4(1): Human oversight as defense against liability,partial,DjimIT (self-reviewed)
NED-04,Transparency & Explainability,priority,MEASURE,MEASURE-1.3: Explainability and interpretability,Art. 13: Transparency and provision of information; Art. 50: Transparency obligations,N/A,N/A,Openbaarheid: Transparantie over AI-besluitvorming,Art. 13: Information and instructions to users,Art. 27: Transparency of recommender systems; Art. 39: Data access for vetted researchers,Art. 5: Right to access information about AI systems,full,DjimIT (self-reviewed)
NED-05,Incident Response & Reporting,priority,MANAGE,MANAGE-2.3: Incident response and recovery,Art. 72: Reporting of serious incidents,C.6-7: Incident response and reporting,"Art. 23: Incident reporting (24h preliminary, 1 month detailed)",N/A,Art. 11: Vulnerability handling and incident reporting,Art. 13: Notice and action mechanisms,Art. 8: Disclosure of AI-related evidence,full,DjimIT (self-reviewed)
NED-06,Secure Development & Vulnerability Management,priority,GOVERN,GOVERN-1.2: Secure development policies,"Art. 15: Accuracy, robustness, and cybersecurity",B.3: Beveiliging in ontwikkeling en onderhoud,Art. 21(2)(d): Security in network/system development,Beveiliging is basisvoorwaarde,Art. 11: Vulnerability handling; Art. 13: Secure by design,N/A,Art. 4(3): Product security as defense factor,full,DjimIT (self-reviewed)
NED-07,Platform Transparency & Content Governance,priority,MEASURE,MEASURE-1.1: Metrics for platform governance,Art. 13: Transparency obligations for AI systems,N/A,N/A,Openbaarheid: Transparantie over dienstverlening,N/A,Art. 13-15: Notice and action; Art. 27: Recommender transparency; Art. 39: Data access,Art. 5: Access to information for damage claims,partial,DjimIT (self-reviewed)
NED-08,AI Liability & Evidence Preservation,priority,MANAGE,MANAGE-3: AI risk management documentation,Art. 12: Record-keeping and logging,C.4: Logging en monitoring,Art. 23: Incident documentation,Verantwoordelijkheid: Aantoonbare AI-governance,Art. 11: Incident and vulnerability documentation,Art. 13: Content moderation records,Art. 3: Burden of proof; Art. 5: Disclosure; Art. 8: Evidence,full,DjimIT (self-reviewed)
